{"item_id":"we-v2.1.2-live-T083657Z-001","section":"Written Expression","agent_version":"Written Expression Generator v2.1","primary_target":"CLAUSE_STRUCTURE","subtype":"subject-verb agreement across an intervening participial modifier","secondary_features":["intervening participial modifier","relative clause"],"tested_error_type":"agreement_error","difficulty":"MEDIUM","vocabulary_domain":"paleoclimatology","sentence":"In recent studies, researchers examining pollen records from lakes identifies patterns that reveal how climates changed after eruptions.","marked_parts":{"A":"studies","B":"records","C":"identifies","D":"after eruptions"},"correct_answer":"C","error_explanation":"The plural subject researchers requires the base-form finite verb identify; the singular form identifies does not agree with the subject.","minimal_correction":"Replace identifies with identify.","grammar_metadata":{"error_scope":"clause_level","correction_locality":"DEPENDENCY_BASED","decision_granularity":"AGREEMENT_DEPENDENCY","intended_error_position":"C","correct_span_type":"SINGLE_WORD"},"format_metadata":{"target_sentence_length_region":"16-20 (empirical target 16; conformance range 14-18 words)","expected_span_profile":"Empirical correct-span draw: SINGLE_WORD; selected surface span lengths 1/1/1/2","coverage_profile":"PREFERRED empirical coverage band; 5 of 18 lexical words marked (27.78%)","approximate_context_profile":"13 unmarked lexical words; inter-span gaps A-B/B-C/C-D = 3/2/6, with C-D in the WARNING tail","span_types":{"A":"SINGLE_WORD","B":"SINGLE_WORD","C":"SINGLE_WORD","D":"SHORT_PHRASE"},"diagnostics":{"sentence_word_count":18,"span_word_counts":{"A":1,"B":1,"C":1,"D":2},"mean_span_length":1.25,"max_span_length":2,"marked_coverage_ratio":0.2778,"unmarked_word_count":13,"gap_A_B":3,"gap_B_C":2,"gap_C_D":6,"correct_span_word_count":1,"correct_span_type":"SINGLE_WORD","correction_locality":"DEPENDENCY_BASED","decision_granularity":"AGREEMENT_DEPENDENCY","format_distribution_distance":0.3327,"format_percentile_profile":{},"format_band_status":"WARNING","metric_band_status":{},"span_token_indices":{"A":[2],"B":[6],"C":[9],"D":[16,17]}}},"provenance":{"agent_version":"Written Expression Generator v2.1","prompt_hash":null,"spec_version":"1.0.0","format_spec_version":"1.0.0","generation_batch_id":"we-v2.1.2-live-e2e-20260826T083657Z","microbatch_id":"we-v2.1.2-live-e2e-20260826T083657Z-microbatch-001","item_generation_order":1,"invocation_id":null,"runtime_model":null},"qa_metadata":{"clean_form":"In recent studies, researchers examining pollen records from lakes identify patterns that reveal how climates changed after eruptions.","error_form":"In recent studies, researchers examining pollen records from lakes identifies patterns that reveal how climates changed after eruptions.","minimal_correction":"Replace identifies with identify.","mutation_type":"subject-verb agreement: identify -> identifies.","clean_sentence_validated":true,"grammar_check_status":"PASS","format_check_status":"WARN"}}