{"item_id":"we-v2.1.2-live-T091038Z-010","section":"Written Expression","agent_version":"Written Expression Generator v2.1","primary_target":"parallelism","subtype":"coordinated verb forms","secondary_features":["academic register","infinitival complementation"],"tested_error_type":"nonparallel verb form in a coordinated series","difficulty":"MEDIUM","vocabulary_domain":"environmental policy","sentence":"The regional plan requires factories to reduce emissions, improve filtration systems, and monitoring water quality near industrial sites.","marked_parts":{"A":"The regional plan","B":"requires factories","C":"improve filtration systems","D":"monitoring"},"correct_answer":"D","error_explanation":"The three coordinated verbs following “to” must use parallel base forms: “reduce,” “improve,” and “monitor.” The -ing form “monitoring” is grammatically incorrect here.","minimal_correction":"Change “monitoring” to “monitor.”","grammar_metadata":{"error_scope":"clause_level","correction_locality":"LOCAL_SINGLE_TOKEN","decision_granularity":"VERB_FRAME","intended_error_position":"D","correct_span_type":"SINGLE_WORD"},"format_metadata":{"target_sentence_length_region":"16–25 words (sampled official observed region)","expected_span_profile":"Four local spans with local phrase distractors and one single-word error span","coverage_profile":"Moderate partial coverage with unmarked context","approximate_context_profile":"Academic sentence with coordinated infinitival complements","span_types":{"A":"SHORT_PHRASE","B":"SHORT_PHRASE","C":"SHORT_PHRASE","D":"SINGLE_WORD"},"diagnostics":{"sentence_word_count":18,"span_word_counts":{"A":3,"B":2,"C":3,"D":1},"mean_span_length":2.25,"max_span_length":3,"marked_coverage_ratio":0.5,"unmarked_word_count":9,"gap_A_B":0,"gap_B_C":3,"gap_C_D":1,"correct_span_word_count":1,"correct_span_type":"SINGLE_WORD","correction_locality":"LOCAL_SINGLE_TOKEN","decision_granularity":"VERB_FRAME","format_distribution_distance":0.0,"format_percentile_profile":{},"format_band_status":"PREFERRED","metric_band_status":{},"span_token_indices":{"A":[0,1,2],"B":[3,4],"C":[8,9,10],"D":[12]}}},"provenance":{"agent_version":"Written Expression Generator v2.1","prompt_hash":null,"spec_version":"toefl_itp_we_generator_v2.1.2","format_spec_version":"we_v2.1.1_format_locked","generation_batch_id":"we-v2.1.2-live-e2e-20260826T091038Z","microbatch_id":"live-microbatch-010","item_generation_order":10,"invocation_id":null,"runtime_model":null},"qa_metadata":{"clean_form":"The regional plan requires factories to reduce emissions, improve filtration systems, and monitor water quality near industrial sites.","error_form":"The regional plan requires factories to reduce emissions, improve filtration systems, and monitoring water quality near industrial sites.","minimal_correction":"Change “monitoring” to “monitor.”","mutation_type":"base-form-to-ing parallel mutation","clean_sentence_validated":true,"grammar_check_status":"PASS","format_check_status":"PASS"}}