{"item_id":"we-v2.1.2-live-T091038Z-007","section":"Written Expression","agent_version":"Written Expression Generator v2.1","primary_target":"CLAUSE_STRUCTURE","subtype":"subject–verb agreement across an intervening prepositional phrase","secondary_features":["complex noun phrase","subordinate concessive clause","academic register"],"tested_error_type":"agreement_error","difficulty":"MEDIUM","vocabulary_domain":"environmental science","sentence":"Although the preliminary measurements from three remote stations were inconsistent, the revised estimates of seasonal currents reveals a stable tidal pattern.","marked_parts":{"A":"measurements","B":"stations","C":"estimates","D":"reveals"},"correct_answer":"D","error_explanation":"The plural subject estimates requires the plural verb reveal, not the singular form reveals.","minimal_correction":"reveals -> reveal","grammar_metadata":{"error_scope":"local","correction_locality":"DEPENDENCY_BASED","decision_granularity":"AGREEMENT_DEPENDENCY","intended_error_position":"D","correct_span_type":"SINGLE_WORD"},"format_metadata":{"target_sentence_length_region":"21–25 words (empirical target 23; realized 21)","expected_span_profile":"Four single-word spans with a single-word agreement locus and distributed lexical gaps.","coverage_profile":"Preferred-range coverage with substantial unmarked context.","approximate_context_profile":"Academic sentence with a concessive subordinate clause, intervening prepositional phrases, and a main-clause agreement dependency.","span_types":{"A":"SINGLE_WORD","B":"SINGLE_WORD","C":"SINGLE_WORD","D":"SINGLE_WORD"},"diagnostics":{"sentence_word_count":21,"span_word_counts":{"A":1,"B":1,"C":1,"D":1},"mean_span_length":1.0,"max_span_length":1,"marked_coverage_ratio":0.1905,"unmarked_word_count":17,"gap_A_B":3,"gap_B_C":4,"gap_C_D":3,"correct_span_word_count":1,"correct_span_type":"SINGLE_WORD","correction_locality":"DEPENDENCY_BASED","decision_granularity":"AGREEMENT_DEPENDENCY","format_distribution_distance":0.7605,"format_percentile_profile":{ },"format_band_status":"PREFERRED","metric_band_status":{},"span_token_indices":{"A":[3],"B":[7],"C":[12],"D":[16]}}},"provenance":{"agent_version":"Written Expression Generator v2.1","prompt_hash":null,"spec_version":"v2.1.2","format_spec_version":"v2.1.1-locked","generation_batch_id":"we-v2.1.2-live-e2e-20260826T091038Z","microbatch_id":"microbatch-007","item_generation_order":7,"invocation_id":null,"runtime_model":null},"qa_metadata":{"clean_form":"Although the preliminary measurements from three remote stations were inconsistent, the revised estimates of seasonal currents reveal a stable tidal pattern.","error_form":"Although the preliminary measurements from three remote stations were inconsistent, the revised estimates of seasonal currents reveals a stable tidal pattern.","minimal_correction":"reveals -> reveal","mutation_type":"subject-verb agreement: reveal -> reveals","clean_sentence_validated":true,"grammar_check_status":"PASS","format_check_status":"PASS"}}