{"item_id":"we-v2.1.2-live-T091038Z-009","section":"Written Expression","agent_version":"Written Expression Generator v2.1","primary_target":"CLAUSE_STRUCTURE","subtype":"subject–verb agreement across an intervening prepositional phrase","secondary_features":["complex subject noun phrase","academic register"],"tested_error_type":"agreement_error","difficulty":"MEDIUM","vocabulary_domain":"environmental monitoring","sentence":"The network of sensors installed across alpine valleys now regularly detect subtle shifts in temperature before they threaten nearby ecosystems.","marked_parts":{"A":"The","B":"sensors","C":"alpine","D":"detect"},"correct_answer":"D","error_explanation":"The head noun of the subject is the singular noun “network,” so the finite verb must be singular: “detects.” The plural noun “sensors” is inside an intervening prepositional phrase and does not control agreement.","minimal_correction":"Change detect to detects.","grammar_metadata":{"error_scope":"clause_level","correction_locality":"DEPENDENCY_BASED","decision_granularity":"AGREEMENT_DEPENDENCY","intended_error_position":"D","correct_span_type":"SINGLE_WORD"},"format_metadata":{"target_sentence_length_region":"18–22 words (sampled target: 20; official source: official.items[].sentence_word_count)","expected_span_profile":"Four predominantly single-word local spans","coverage_profile":"20% marked coverage, within the preferred empirical region","approximate_context_profile":"Sixteen unmarked words with gaps of 2, 2, and 3 lexical words","span_types":{"A":"SINGLE_WORD","B":"SINGLE_WORD","C":"SINGLE_WORD","D":"SINGLE_WORD"},"diagnostics":{"sentence_word_count":20,"span_word_counts":{"A":1,"B":1,"C":1,"D":1},"mean_span_length":1.0,"max_span_length":1,"marked_coverage_ratio":0.2,"unmarked_word_count":16,"gap_A_B":2,"gap_B_C":2,"gap_C_D":3,"correct_span_word_count":1,"correct_span_type":"SINGLE_WORD","correction_locality":"DEPENDENCY_BASED","decision_granularity":"AGREEMENT_DEPENDENCY","format_distribution_distance":0.6869,"format_percentile_profile":{},"format_band_status":"PREFERRED","metric_band_status":{},"span_token_indices":{"A":[0],"B":[3],"C":[6],"D":[10]}}},"provenance":{"agent_version":"Written Expression Generator v2.1","prompt_hash":null,"spec_version":"toefl-itp-we-generator-v2.1.2","format_spec_version":"we-v2.1.1-format-lock","generation_batch_id":"we-v2.1.2-live-e2e-20260826T091038Z","microbatch_id":"live-microbatch-009","item_generation_order":9,"invocation_id":null,"runtime_model":null},"qa_metadata":{"clean_form":"The network of sensors installed across alpine valleys now regularly detects subtle shifts in temperature before they threaten nearby ecosystems.","error_form":"The network of sensors installed across alpine valleys now regularly detect subtle shifts in temperature before they threaten nearby ecosystems.","minimal_correction":"Change detect to detects.","mutation_type":"detects -> detect: subject-verb agreement mutation","clean_sentence_validated":true,"grammar_check_status":"PASS","format_check_status":"PASS"}}