{"item_id":"we-v2.1.2-live-T083657Z-003","section":"Written Expression","agent_version":"Written Expression Generator v2.1","primary_target":"CLAUSE_STRUCTURE","subtype":"subject-verb agreement across an intervening prepositional phrase","secondary_features":["complex subject with an of-phrase","subject head separated from the finite verb","academic environmental-science vocabulary"],"tested_error_type":"agreement_error","difficulty":"MEDIUM","vocabulary_domain":"glaciology and hydrology","sentence":"The sequence of images from satellites reveal gradual shifts in glacier coverage, helping scientists estimate water supplies during dry summers.","marked_parts":{"A":"The sequence","B":"reveal","C":"coverage","D":"water"},"correct_answer":"B","error_explanation":"The singular subject head “sequence” requires the correct form “reveals”; the marked form “reveal” is ungrammatical here.","minimal_correction":"reveal -> reveals","grammar_metadata":{"error_scope":"clause_level","correction_locality":"DEPENDENCY_BASED","decision_granularity":"AGREEMENT_DEPENDENCY","intended_error_position":"B","correct_span_type":"SINGLE_WORD"},"format_metadata":{"target_sentence_length_region":"16–20 words (empirical draw target 18 ± 2)","expected_span_profile":"Four local spans, primarily single-word spans, with partial coverage and nonzero lexical gaps.","coverage_profile":"Partial marked coverage near the official central range, with unmarked context retained throughout the sentence.","approximate_context_profile":"Academic sentence with a complex subject, an intervening prepositional phrase, and a participial clause.","span_types":{"A":"SHORT_PHRASE","B":"SINGLE_WORD","C":"SINGLE_WORD","D":"SINGLE_WORD"},"diagnostics":{"sentence_word_count":20,"span_word_counts":{"A":2,"B":1,"C":1,"D":1},"mean_span_length":1.25,"max_span_length":2,"marked_coverage_ratio":0.25,"unmarked_word_count":15,"gap_A_B":4,"gap_B_C":4,"gap_C_D":3,"correct_span_word_count":1,"correct_span_type":"SINGLE_WORD","correction_locality":"DEPENDENCY_BASED","decision_granularity":"AGREEMENT_DEPENDENCY","format_distribution_distance":0.1472,"format_percentile_profile":{		},"format_band_status":"PREFERRED","metric_band_status":{},"span_token_indices":{"A":[0,1],"B":[6],"C":[11],"D":[15]}}},"provenance":{"agent_version":"Written Expression Generator v2.1","prompt_hash":null,"spec_version":"v2.1.2","format_spec_version":"v2.1.1-locked","generation_batch_id":"we-v2.1.2-live-e2e-20260826T083657Z","microbatch_id":"we-v2.1.2-live-e2e-20260826T083657Z-micro-003","item_generation_order":3,"invocation_id":null,"runtime_model":null},"qa_metadata":{"clean_form":"The sequence of images from satellites reveals gradual shifts in glacier coverage, helping scientists estimate water supplies during dry summers.","error_form":"The sequence of images from satellites reveal gradual shifts in glacier coverage, helping scientists estimate water supplies during dry summers.","minimal_correction":"reveal -> reveals","mutation_type":"reveals -> reveal","clean_sentence_validated":true,"grammar_check_status":"PASS","format_check_status":"PASS"}}