{"item_id":"we-v2.1.2-live-T091038Z-002","section":"Written Expression","agent_version":"Written Expression Generator v2.1","primary_target":"CLAUSE_STRUCTURE","subtype":"subject_verb_agreement","secondary_features":["present-tense academic statement","complex subject noun phrase"],"tested_error_type":"agreement_error","difficulty":"MEDIUM","vocabulary_domain":"environmental engineering","sentence":"Researchers examining ancient irrigation systems has identified several design principles that modern engineers can adapt to conserve water in arid regions.","marked_parts":{"A":"Researchers","B":"ancient","C":"has","D":"modern engineers"},"correct_answer":"C","error_explanation":"The plural subject \"Researchers\" requires the plural auxiliary \"have\"; the singular form \"has\" is incorrect.","minimal_correction":"has -> have","grammar_metadata":{"error_scope":"clause_level","correction_locality":"DEPENDENCY_BASED","decision_granularity":"AGREEMENT_DEPENDENCY","intended_error_position":"C","correct_span_type":"SINGLE_WORD"},"format_metadata":{"target_sentence_length_region":"19–23 words","expected_span_profile":"mostly single-word spans with one short phrase and separated contextual spans","coverage_profile":"moderate marked coverage with substantial unmarked context","approximate_context_profile":"academic environmental-engineering context with distributed local spans","span_types":{"A":"SINGLE_WORD","B":"SINGLE_WORD","C":"SINGLE_WORD","D":"SHORT_PHRASE"},"diagnostics":{"sentence_word_count":21,"span_word_counts":{"A":1,"B":1,"C":1,"D":2},"mean_span_length":1.25,"max_span_length":2,"marked_coverage_ratio":0.2381,"unmarked_word_count":16,"gap_A_B":1,"gap_B_C":2,"gap_C_D":5,"correct_span_word_count":1,"correct_span_type":"SINGLE_WORD","correction_locality":"DEPENDENCY_BASED","decision_granularity":"AGREEMENT_DEPENDENCY","format_distribution_distance":0.2705,"format_percentile_profile":{ },"format_band_status":"WARNING","metric_band_status":{ },"span_token_indices":{"A":[0],"B":[2],"C":[5],"D":[11,12]}}},"provenance":{"agent_version":"Written Expression Generator v2.1","prompt_hash":null,"spec_version":"v2.1.2","format_spec_version":"v2.1.1-locked","generation_batch_id":"we-v2.1.2-live-e2e-20260826T091038Z","microbatch_id":"live-microbatch-002","item_generation_order":2,"invocation_id":null,"runtime_model":null},"qa_metadata":{"clean_form":"Researchers examining ancient irrigation systems have identified several design principles that modern engineers can adapt to conserve water in arid regions.","error_form":"Researchers examining ancient irrigation systems has identified several design principles that modern engineers can adapt to conserve water in arid regions.","minimal_correction":"has -> have","mutation_type":"SUBJECT_VERB_AGREEMENT: have -> has","clean_sentence_validated":true,"grammar_check_status":"PASS","format_check_status":"WARN"}}