{"item_id":"we-v2.1.2-live-T091038Z-003","section":"Written Expression","agent_version":"Written Expression Generator v2.1","primary_target":"CLAUSE_STRUCTURE","subtype":"Subject–verb agreement across an intervening prepositional phrase","secondary_features":["complex noun phrase","academic register","geology context"],"tested_error_type":"agreement_error","difficulty":"EASY","vocabulary_domain":"Geology and earth science","sentence":"The collection of mineral samples from remote valleys reveals how ancient rivers shaped the region's distinctive geological landscape over thousands of years.","marked_parts":{"A":"collection","B":"from","C":"reveals","D":"region's"},"correct_answer":"C","error_explanation":"The singular head noun collection requires the singular verb reveals. The intervening plural noun samples does not control agreement.","minimal_correction":"reveal -> reveals","grammar_metadata":{"error_scope":"local","correction_locality":"DEPENDENCY_BASED","decision_granularity":"AGREEMENT_DEPENDENCY","intended_error_position":"C","correct_span_type":"SINGLE_WORD"},"format_metadata":{"target_sentence_length_region":"20–24 words","expected_span_profile":"Predominantly single-word local spans with substantial unmarked context","coverage_profile":"Low-to-central official coverage with nonzero gaps","approximate_context_profile":"Academic geology sentence with distributed local candidates","span_types":{"A":"SINGLE_WORD","B":"SINGLE_WORD","C":"SINGLE_WORD","D":"SINGLE_WORD"},"diagnostics":{"sentence_word_count":22,"span_word_counts":{"A":1,"B":1,"C":1,"D":1},"mean_span_length":1.0,"max_span_length":1,"marked_coverage_ratio":0.1818,"unmarked_word_count":18,"gap_A_B":3,"gap_B_C":2,"gap_C_D":5,"correct_span_word_count":1,"correct_span_type":"SINGLE_WORD","correction_locality":"DEPENDENCY_BASED","decision_granularity":"AGREEMENT_DEPENDENCY","format_distribution_distance":0.8596,"format_percentile_profile":{ },"format_band_status":"PREFERRED","metric_band_status":{ },"span_token_indices":{"A":[1],"B":[5],"C":[8],"D":[14]}}},"provenance":{"agent_version":"Written Expression Generator v2.1","prompt_hash":null,"spec_version":"v2.1.2","format_spec_version":"v2.1.1-locked","generation_batch_id":"we-v2.1.2-live-e2e-20260826T091038Z","microbatch_id":"we-v2.1.2-live-e2e-20260826T091038Z-microbatch-003","item_generation_order":3,"invocation_id":null,"runtime_model":null},"qa_metadata":{"clean_form":"The collection of mineral samples from remote valleys reveals how ancient rivers shaped the region's distinctive geological landscape over thousands of years.","error_form":"The collection of mineral samples from remote valleys reveal how ancient rivers shaped the region's distinctive geological landscape over thousands of years.","minimal_correction":"reveal -> reveals","mutation_type":"reveals -> reveal","clean_sentence_validated":true,"grammar_check_status":"PASS","format_check_status":"PASS"}}