{"item_id":"we-v2.1.2-live-T091038Z-004","section":"Written Expression","agent_version":"Written Expression Generator v2.1","primary_target":"CLAUSE_STRUCTURE","subtype":"Subject–verb agreement across an intervening prepositional phrase","secondary_features":["prepositional phrase","academic register"],"tested_error_type":"agreement_error","difficulty":"MEDIUM","vocabulary_domain":"Environmental science","sentence":"The effects of intermittent summer rainfall on coastal wetlands remains difficult to predict because drainage patterns vary considerably during annual thaw.","marked_parts":{"A":"The","B":"intermittent","C":"on","D":"remains difficult"},"correct_answer":"D","error_explanation":"The plural subject “effects” requires the plural verb “remain,” not “remains.”","minimal_correction":"remains -> remain","grammar_metadata":{"error_scope":"clause_level","correction_locality":"DEPENDENCY_BASED","decision_granularity":"AGREEMENT_DEPENDENCY","intended_error_position":"D","correct_span_type":"SHORT_PHRASE"},"format_metadata":{"target_sentence_length_region":"21-25","expected_span_profile":"Primarily single-word local spans with one short phrase; distributed grammatical context","coverage_profile":"Central official-style partial coverage with substantial unmarked context","approximate_context_profile":"Academic explanatory sentence with a multiword subject and intervening prepositional modifiers","span_types":{"A":"SINGLE_WORD","B":"SINGLE_WORD","C":"SINGLE_WORD","D":"SHORT_PHRASE"},"diagnostics":{"sentence_word_count":21,"span_word_counts":{"A":1,"B":1,"C":1,"D":2},"mean_span_length":1.25,"max_span_length":2,"marked_coverage_ratio":0.2381,"unmarked_word_count":16,"gap_A_B":2,"gap_B_C":2,"gap_C_D":2,"correct_span_word_count":2,"correct_span_type":"SHORT_PHRASE","correction_locality":"DEPENDENCY_BASED","decision_granularity":"AGREEMENT_DEPENDENCY","format_distribution_distance":0.2705,"format_percentile_profile":{},"format_band_status":"PREFERRED","metric_band_status":{},"span_token_indices":{"A":[0],"B":[3],"C":[6],"D":[9,10]}}},"provenance":{"agent_version":"Written Expression Generator v2.1","prompt_hash":null,"spec_version":"toefl_itp_we_generator_v2.1.2","format_spec_version":"we_v2.1.1_locked","generation_batch_id":"we-v2.1.2-live-e2e-20260826T091038Z","microbatch_id":"live-microbatch-004","item_generation_order":4,"invocation_id":null,"runtime_model":null},"qa_metadata":{"clean_form":"The effects of intermittent summer rainfall on coastal wetlands remain difficult to predict because drainage patterns vary considerably during annual thaw.","error_form":"The effects of intermittent summer rainfall on coastal wetlands remains difficult to predict because drainage patterns vary considerably during annual thaw.","minimal_correction":"remains -> remain","mutation_type":"remain -> remains (subject–verb agreement mutation)","clean_sentence_validated":true,"grammar_check_status":"PASS","format_check_status":"PASS"}}