{"item_id":"we-v2.1.2-live-T081059Z-001","section":"Written Expression","agent_version":"Written Expression Generator v2.1","primary_target":"CLAUSE_STRUCTURE","subtype":"subject-verb agreement across an intervening prepositional phrase","secondary_features":["complex noun phrase subject","embedded that-clause","academic register"],"tested_error_type":"agreement_error","difficulty":"MEDIUM","vocabulary_domain":"ecology","sentence":"Recent records from five coastal stations show that wetland regions steadily influences local ecosystems.","marked_parts":{"A":"Recent","B":"coastal stations","C":"wetland","D":"influences"},"correct_answer":"D","error_explanation":"The subject head noun regions is plural, so the correct verb form is influence; influences is the singular form and is incorrect here.","minimal_correction":"influences -> influence","grammar_metadata":{"error_scope":"clause_level","correction_locality":"DEPENDENCY_BASED","decision_granularity":"AGREEMENT_DEPENDENCY","intended_error_position":"D","correct_span_type":"SINGLE_WORD"},"format_metadata":{"target_sentence_length_region":"11-15 (sampled target 13; tolerance range 11-15)","expected_span_profile":"sampled correct span type SINGLE_WORD with a one-word target and one-word distractor draw; one natural 2-word distractor was selected","coverage_profile":"realized coverage is 35.71%, within the preferred empirical coverage band","approximate_context_profile":"9 unmarked words with nonzero lexical gaps of 3/2/2","span_types":{"A":"SINGLE_WORD","B":"SHORT_PHRASE","C":"SINGLE_WORD","D":"SINGLE_WORD"},"diagnostics":{"sentence_word_count":14,"span_word_counts":{"A":1,"B":2,"C":1,"D":1},"mean_span_length":1.25,"max_span_length":2,"marked_coverage_ratio":0.3571,"unmarked_word_count":9,"gap_A_B":3,"gap_B_C":2,"gap_C_D":2,"correct_span_word_count":1,"correct_span_type":"SINGLE_WORD","correction_locality":"DEPENDENCY_BASED","decision_granularity":"AGREEMENT_DEPENDENCY","format_distribution_distance":1.1065,"format_percentile_profile":{},"format_band_status":"WARNING","metric_band_status":{},"span_token_indices":{"A":[0],"B":[4,5],"C":[8],"D":[11]}}},"provenance":{"agent_version":"Written Expression Generator v2.1","prompt_hash":null,"spec_version":"2.1.2","format_spec_version":"2.1.1","generation_batch_id":"we-v2.1.2-live-e2e-20260826T081059Z","microbatch_id":"we-v2.1.2-live-e2e-20260826T081059Z-micro-001","item_generation_order":1,"invocation_id":null,"runtime_model":null},"qa_metadata":{"clean_form":"Recent records from five coastal stations show that wetland regions steadily influence local ecosystems.","error_form":"Recent records from five coastal stations show that wetland regions steadily influences local ecosystems.","minimal_correction":"influences -> influence","mutation_type":"influence -> influences","clean_sentence_validated":true,"grammar_check_status":"PASS","format_check_status":"WARN"}}