{"item_id":"codex-schema-probe-001","section":"Written Expression","agent_version":"Written Expression Generator v2.1","primary_target":"Subject-verb agreement","subtype":"Plural subject with present perfect verb","secondary_features":["present perfect","relative clause"],"tested_error_type":"Subject-verb agreement","difficulty":"MEDIUM","vocabulary_domain":"Agriculture","sentence":"Although the valley receives little rainfall, its farmers has developed irrigation systems that allow them to grow vegetables throughout the year.","marked_parts":{"A":"Although the valley","B":"receives little rainfall,","C":"its farmers has developed irrigation systems","D":"that allow them to grow vegetables throughout the year."},"correct_answer":"C","error_explanation":"The plural subject “farmers” requires the plural auxiliary “have,” not “has.”","minimal_correction":"Change “has” to “have.”","grammar_metadata":{"error_scope":"local","correction_locality":"DEPENDENCY_BASED","decision_granularity":"AGREEMENT_DEPENDENCY","intended_error_position":"C","correct_span_type":"SINGLE_WORD"},"format_metadata":{"target_sentence_length_region":"18–24 words","expected_span_profile":"Four contiguous marked spans with one clause-level span","coverage_profile":"Full sentence coverage","approximate_context_profile":"Academic agriculture context","span_types":{"A":"SHORT_PHRASE","B":"SHORT_PHRASE","C":"CLAUSE_OR_CLAUSE_LIKE","D":"CLAUSE_OR_CLAUSE_LIKE"},"diagnostics":{"sentence_word_count":21,"span_word_counts":{"A":3,"B":3,"C":5,"D":10},"mean_span_length":5.25,"max_span_length":10,"marked_coverage_ratio":1,"unmarked_word_count":0,"gap_A_B":0,"gap_B_C":0,"gap_C_D":0,"correct_span_word_count":1,"correct_span_type":"SINGLE_WORD","correction_locality":"DEPENDENCY_BASED","decision_granularity":"AGREEMENT_DEPENDENCY","format_distribution_distance":0,"format_percentile_profile":{},"format_band_status":"PREFERRED","metric_band_status":{ },"span_token_indices":{"A":[1,2,3],"B":[4,5,6],"C":[7,8,9,10,11],"D":[12,13,14,15,16,17,18,19,20,21]}}},"provenance":{"agent_version":"Written Expression Generator v2.1","prompt_hash":null,"spec_version":"2.1","format_spec_version":"2.1","generation_batch_id":"schema-probe-batch-001","microbatch_id":"schema-probe-microbatch-001","item_generation_order":1,"invocation_id":null,"runtime_model":null},"qa_metadata":{"clean_form":"Although the valley receives little rainfall, its farmers have developed irrigation systems that allow them to grow vegetables throughout the year.","error_form":"Although the valley receives little rainfall, its farmers has developed irrigation systems that allow them to grow vegetables throughout the year.","minimal_correction":"Change “has” to “have.”","mutation_type":"subject-verb agreement mutation","clean_sentence_validated":true,"grammar_check_status":"PASS","format_check_status":"PASS"}}